Description,Price,Stars,Reviews,Url
7-Sided Portable Pill Box Medicine Planner Small case,Rs. 26.00,4.65,49 reviews,https://deodap.in/products/7-sided-portable-pill-box-medicine-planner-small-case
Mini Stapler with 1 Strip of Staples (1...,Rs. 15.00,4.62,50 reviews,https://deodap.in/products/mini-stapler-with-1-strip-of-staples-1-set
Night HD Vision Driving Anti Glare Eyeglasses,Rs. 97.00,4.56,57 reviews,https://deodap.in/products/0507-night-hd-vision-driving-anti-glare-eyeglasses
Heavy Duty Flower Adhesive Wall Hooks - (10...,Rs. 15.00,4.80,20 reviews,https://deodap.in/products/heavy-duty-adhesive-wall-hooks-10-pc-set
Manual Hand Finger Counting Machine Digital Head Electron...,Rs. 25.00,4.79,24 reviews,https://deodap.in/products/9041-manual-hand-finger-counting-machine-digital-head-electronic-tally-counter
Wooden / Bamboo Brush Toothbrush Ultra Soft Bristles...,Rs. 14.00,4.55,49 reviews,https://deodap.in/products/wooden-bamboo-brush-toothbrush-ultra-soft-bristles-1-pc
"5 in 1 Multipurpose Plastic Hanger, Assorted (5-Layer)",Rs. 17.00,4.27,55 reviews,https://deodap.in/products/0587-5-in-1-multipurpose-plastic-hanger-assorted-5-layer
Metallic Cable Protector for Cords & Headphones (Spir...,Rs. 25.00,4.86,21 reviews,https://deodap.in/products/metallic-finish-cable-spiral-protector-wire-repair-pet-cord-protector-headphone-saver-cable-wrap-cover-for-mac-charging-cable
LED Flexible Wire Waterproof Lights for Party (2AA...,Rs. 26.00,4.44,27 reviews,https://deodap.in/products/led-flexible-wire-waterproof-lights-for-party-2aa-battery-operated-batt
4-Layer Transparent Multipurpose Plastic Storage Box,Rs. 194.00,4.80,51 reviews,https://deodap.in/products/4-layer-transparent-multipurpose-plastic-storage-box
"12 Mini Colouring Pencils with Sharpener, Kids Drawing...",Rs. 40.00,4.20,25 reviews,https://deodap.in/products/7957-12-colouring-pencils-kids-set-pencils-sharpener-mini-drawing-colored-pencils-with-sharpener-kawaii-manual-pencil-cutter-coloring-pencil-accessory-school-supplies-for-kid-artists-writing-sketching
Beach Bag Shoes Storage Bag (1 Pc /...,Rs. 17.00,4.00,1 review,https://deodap.in/products/beach-bag-shoes-storage-bag-closet-organizer-non-woven-travel-portable-bag-waterproof-pocket-clothing-classified-hanging-bag-shoe-bag-luggage-travel-portable-shoe-pouch-non-woven-transparent-window-1-pc
Jade Roller & Gua Sha Set – Natural...,Rs. 76.00,4.13,46 reviews,https://deodap.in/products/gua-sha-stone-jade-roller-massager-set
Strawberry Design Relief: Mini Hot Water Bag for...,Rs. 35.00,4.19,26 reviews,https://deodap.in/products/strawberry-design-small-hot-water-bag
Premium Stainless Steel Reusable Chopsticks (2 Pc),Rs. 15.00,4.50,10 reviews,https://deodap.in/products/premium-stainless-steel-reusable-chopsticks-2-pc
2-in-1 Portable Lint Remover – Long-Handle Brush &...,Rs. 34.00,3.97,35 reviews,https://deodap.in/products/portable-lint-remover-long-handle-brush-roller
Manual Red & Black Knife Sharpener 3 Stage...,Rs. 57.00,4.53,32 reviews,https://deodap.in/products/2051-red-black-knife-sharpener-3-stage-sharpening-tool
Digital LCD Alarm Clock with Backlight (1 Pc),Rs. 192.00,4.57,49 reviews,https://deodap.in/products/digital-lcd-alarm-clock-with-backlight-1-pc
3 in 1 point Function Stylus Pen with...,Rs. 10.45,4.21,28 reviews,https://deodap.in/products/3-in-1-ballpoint-stylus-pen
Door Seal Twin Draught Draft Guard,Rs. 23.00,4.72,25 reviews,https://deodap.in/products/0588-door-seal-twin-draught-draft-guard
"3 in 1 Reusable Spoon, Knife Forks Tableware,...",Rs. 15.00,4.18,22 reviews,https://deodap.in/products/10319_3in1_pla_reusable_spoon_set
"Car Blind Spot Mirror – HD Glass, Convex...",Rs. 33.00,4.29,24 reviews,https://deodap.in/products/convex-glass-blindspot-mirror
ADJUSTABLE FOLDING SHOE SLOTS ORGANIZER.,Rs. 30.00,4.48,31 reviews,https://deodap.in/products/7277-adjustable-folding-shoe-slots-organizer
Multipurpose Heavy Duty Small Dori Bag (1 Pc),Rs. 15.00,4.52,40 reviews,https://deodap.in/products/18549_small_dori_bag_1pc
2 in 1 Wireless Vacuum Cleaner – 120W...,Rs. 198.00,4.41,27 reviews,https://deodap.in/products/7370-vacuum-cleaner-usb-rechargeable-portable
Portable Immersion Water Heater Rod - (1 Pc),Rs. 41.00,4.30,10 reviews,https://deodap.in/products/portable-immersion-water-heater-rod-1-pc
Tyre Valve Caps Luminous Glow Car Tire Air...,Rs. 15.00,4.30,30 reviews,https://deodap.in/products/tyre-valve-caps-luminous-glow-car-tire-air-stem-valve-cap-covers-vaal-cap-4-pcs-mix-colour
2-in-1 Silicone Soft Bristle Bath Brush,Rs. 29.00,4.60,15 reviews,https://deodap.in/products/2-in-1-silicone-soft-bristle-bath-brush
"FOLDABLE STORAGE BOX HANDLES, COTTON AND LINEN STORAGE...",Rs. 133.00,4.74,23 reviews,https://deodap.in/products/12627-foldable-storage-box-withhandles-cotton-and-linen-storage-bins-and-baskets-organizer-for-nursery-closet-bedroom-home-45-cm
Mini Steamer & Iron: 2-in-1 Portable Travel Friendly,Rs. 273.00,4.64,33 reviews,https://deodap.in/products/mini-steam-iron-handheld-garment-steamer
7 in 1 Electronic Cleaner kit,Rs. 82.00,4.74,38 reviews,https://deodap.in/products/7-in-1-electronic-cleaner-kit
"Mini Bag Sealer, 2 in 1 Seal &...",Rs. 87.00,4.36,33 reviews,https://deodap.in/products/mini-bag-sealer-2-in-1-seal-cutter-heat-sealers
Solar Wall Lamp – Wireless Outdoor Light with...,Rs. 134.00,4.82,40 reviews,https://deodap.in/products/12564-solar-wall-lights-lamp-outdoor-wireless-dusk-to-dawn-porch-lights-fixture-solar-wall-lantern-with-3-modes-motion-sensor-waterproof-exterior-lighting-with-clear-panel-1-pc
"Squeeze Twist Mop Self Wringing Mop, Stainless Steel...",Rs. 175.00,4.77,57 reviews,https://deodap.in/products/squeeze-twist-mop-self-wringing-mop-for-hardwood-floor-cleaning-telescopic-stainless-steel-handle
"3 in 1 Mini Car Vacuum – Wireless,...",Rs. 205.00,4.56,39 reviews,https://deodap.in/products/7394-3-in-1-car-mini-vacuum-cleaner-with-blower-wireless-portable-rechargeable-handheld-high-power-suction-vacuum-cleaning-machine-for-home-car-computer-keyboard-cordless-air-blowing-dusting
"Cushion Seat Flex Pillow, Gel Orthopedic Seat Cushion...",Rs. 253.00,4.44,27 reviews,https://deodap.in/products/0219-cushion-seat-flex-pillow-gel-orthopedic-seat-cushion-pad-egg-sitter
7-Sided Portable Pill Box Medicine Planner Small case,Rs. 26.00,4.65,49 reviews,https://deodap.in/products/7-sided-portable-pill-box-medicine-planner-small-case
Mini Stapler with 1 Strip of Staples (1...,Rs. 15.00,4.62,50 reviews,https://deodap.in/products/mini-stapler-with-1-strip-of-staples-1-set
Night HD Vision Driving Anti Glare Eyeglasses,Rs. 97.00,4.56,57 reviews,https://deodap.in/products/0507-night-hd-vision-driving-anti-glare-eyeglasses
Heavy Duty Flower Adhesive Wall Hooks - (10...,Rs. 15.00,4.80,20 reviews,https://deodap.in/products/heavy-duty-adhesive-wall-hooks-10-pc-set
Manual Hand Finger Counting Machine Digital Head Electron...,Rs. 25.00,4.79,24 reviews,https://deodap.in/products/9041-manual-hand-finger-counting-machine-digital-head-electronic-tally-counter
Wooden / Bamboo Brush Toothbrush Ultra Soft Bristles...,Rs. 14.00,4.55,49 reviews,https://deodap.in/products/wooden-bamboo-brush-toothbrush-ultra-soft-bristles-1-pc
"5 in 1 Multipurpose Plastic Hanger, Assorted (5-Layer)",Rs. 17.00,4.27,55 reviews,https://deodap.in/products/0587-5-in-1-multipurpose-plastic-hanger-assorted-5-layer
Metallic Cable Protector for Cords & Headphones (Spir...,Rs. 25.00,4.86,21 reviews,https://deodap.in/products/metallic-finish-cable-spiral-protector-wire-repair-pet-cord-protector-headphone-saver-cable-wrap-cover-for-mac-charging-cable
LED Flexible Wire Waterproof Lights for Party (2AA...,Rs. 26.00,4.44,27 reviews,https://deodap.in/products/led-flexible-wire-waterproof-lights-for-party-2aa-battery-operated-batt
4-Layer Transparent Multipurpose Plastic Storage Box,Rs. 194.00,4.80,51 reviews,https://deodap.in/products/4-layer-transparent-multipurpose-plastic-storage-box
"12 Mini Colouring Pencils with Sharpener, Kids Drawing...",Rs. 40.00,4.20,25 reviews,https://deodap.in/products/7957-12-colouring-pencils-kids-set-pencils-sharpener-mini-drawing-colored-pencils-with-sharpener-kawaii-manual-pencil-cutter-coloring-pencil-accessory-school-supplies-for-kid-artists-writing-sketching
Beach Bag Shoes Storage Bag (1 Pc /...,Rs. 17.00,4.00,1 review,https://deodap.in/products/beach-bag-shoes-storage-bag-closet-organizer-non-woven-travel-portable-bag-waterproof-pocket-clothing-classified-hanging-bag-shoe-bag-luggage-travel-portable-shoe-pouch-non-woven-transparent-window-1-pc
Jade Roller & Gua Sha Set – Natural...,Rs. 76.00,4.13,46 reviews,https://deodap.in/products/gua-sha-stone-jade-roller-massager-set
Strawberry Design Relief: Mini Hot Water Bag for...,Rs. 35.00,4.19,26 reviews,https://deodap.in/products/strawberry-design-small-hot-water-bag
Premium Stainless Steel Reusable Chopsticks (2 Pc),Rs. 15.00,4.50,10 reviews,https://deodap.in/products/premium-stainless-steel-reusable-chopsticks-2-pc
2-in-1 Portable Lint Remover – Long-Handle Brush &...,Rs. 34.00,3.97,35 reviews,https://deodap.in/products/portable-lint-remover-long-handle-brush-roller
Manual Red & Black Knife Sharpener 3 Stage...,Rs. 57.00,4.53,32 reviews,https://deodap.in/products/2051-red-black-knife-sharpener-3-stage-sharpening-tool
Digital LCD Alarm Clock with Backlight (1 Pc),Rs. 192.00,4.57,49 reviews,https://deodap.in/products/digital-lcd-alarm-clock-with-backlight-1-pc
3 in 1 point Function Stylus Pen with...,Rs. 10.45,4.21,28 reviews,https://deodap.in/products/3-in-1-ballpoint-stylus-pen
Door Seal Twin Draught Draft Guard,Rs. 23.00,4.72,25 reviews,https://deodap.in/products/0588-door-seal-twin-draught-draft-guard
"3 in 1 Reusable Spoon, Knife Forks Tableware,...",Rs. 15.00,4.18,22 reviews,https://deodap.in/products/10319_3in1_pla_reusable_spoon_set
"Car Blind Spot Mirror – HD Glass, Convex...",Rs. 33.00,4.29,24 reviews,https://deodap.in/products/convex-glass-blindspot-mirror
ADJUSTABLE FOLDING SHOE SLOTS ORGANIZER.,Rs. 30.00,4.48,31 reviews,https://deodap.in/products/7277-adjustable-folding-shoe-slots-organizer
Multipurpose Heavy Duty Small Dori Bag (1 Pc),Rs. 15.00,4.52,40 reviews,https://deodap.in/products/18549_small_dori_bag_1pc
2 in 1 Wireless Vacuum Cleaner – 120W...,Rs. 198.00,4.41,27 reviews,https://deodap.in/products/7370-vacuum-cleaner-usb-rechargeable-portable
Portable Immersion Water Heater Rod - (1 Pc),Rs. 41.00,4.30,10 reviews,https://deodap.in/products/portable-immersion-water-heater-rod-1-pc
Tyre Valve Caps Luminous Glow Car Tire Air...,Rs. 15.00,4.30,30 reviews,https://deodap.in/products/tyre-valve-caps-luminous-glow-car-tire-air-stem-valve-cap-covers-vaal-cap-4-pcs-mix-colour
2-in-1 Silicone Soft Bristle Bath Brush,Rs. 29.00,4.60,15 reviews,https://deodap.in/products/2-in-1-silicone-soft-bristle-bath-brush
"FOLDABLE STORAGE BOX HANDLES, COTTON AND LINEN STORAGE...",Rs. 133.00,4.74,23 reviews,https://deodap.in/products/12627-foldable-storage-box-withhandles-cotton-and-linen-storage-bins-and-baskets-organizer-for-nursery-closet-bedroom-home-45-cm
Mini Steamer & Iron: 2-in-1 Portable Travel Friendly,Rs. 273.00,4.64,33 reviews,https://deodap.in/products/mini-steam-iron-handheld-garment-steamer
7 in 1 Electronic Cleaner kit,Rs. 82.00,4.74,38 reviews,https://deodap.in/products/7-in-1-electronic-cleaner-kit
"Mini Bag Sealer, 2 in 1 Seal &...",Rs. 87.00,4.36,33 reviews,https://deodap.in/products/mini-bag-sealer-2-in-1-seal-cutter-heat-sealers
Solar Wall Lamp – Wireless Outdoor Light with...,Rs. 134.00,4.82,40 reviews,https://deodap.in/products/12564-solar-wall-lights-lamp-outdoor-wireless-dusk-to-dawn-porch-lights-fixture-solar-wall-lantern-with-3-modes-motion-sensor-waterproof-exterior-lighting-with-clear-panel-1-pc
"Squeeze Twist Mop Self Wringing Mop, Stainless Steel...",Rs. 175.00,4.77,57 reviews,https://deodap.in/products/squeeze-twist-mop-self-wringing-mop-for-hardwood-floor-cleaning-telescopic-stainless-steel-handle
"3 in 1 Mini Car Vacuum – Wireless,...",Rs. 205.00,4.56,39 reviews,https://deodap.in/products/7394-3-in-1-car-mini-vacuum-cleaner-with-blower-wireless-portable-rechargeable-handheld-high-power-suction-vacuum-cleaning-machine-for-home-car-computer-keyboard-cordless-air-blowing-dusting
"Cushion Seat Flex Pillow, Gel Orthopedic Seat Cushion...",Rs. 253.00,4.44,27 reviews,https://deodap.in/products/0219-cushion-seat-flex-pillow-gel-orthopedic-seat-cushion-pad-egg-sitter
"Microfiber Dusters for Cleaning, Telescoping Feather Dust...",Rs. 118.00,4.42,52 reviews,https://deodap.in/products/microfiber-dusters-for-cleaning-telescoping-feather-duster-with-100-inches-extendable-handle-pole-dusting-cleaning-tools-for-cleaning-high-ceiling-ceiling-fan-blinds-cobwebs-furniture-cars-001
Cube Tulip Night Lamp | Led Decorative Nights...,Rs. 135.00,4.32,31 reviews,https://deodap.in/products/tulip-night-lamp-for-bedroom
Premium Velvet Travel Jewelry Organizer Box – Compact...,Rs. 88.00,4.00,10 reviews,https://deodap.in/products/premium-velvet-travel-jewelry-organizer-box-for-women-and-girls-compact-portable-storage-case-with-compartments-for-rings-earrings-necklaces-and-bracelets-elegant-pu-leather-gift-box-blush-pink
Solar Lights for Garden LED Security Lamp for...,Rs. 160.00,4.66,32 reviews,https://deodap.in/products/solar-lights-for-garden
"Car Duster, Long Retractable / Soft / Non-Slip...",Rs. 117.00,4.63,52 reviews,https://deodap.in/products/4749_car_cleaning_duster
Anti-Fog & Anti-Scratch Rearview Car Mirror Film –...,Rs. 24.00,4.70,30 reviews,https://deodap.in/products/anti-fog-anti-scratch-rearview-car-mirror-film-hd-clear-protective-sticker-for-safe-driving-1-pc
Transparent Waterproof Glue 300g Without Brush (1 pc),Rs. 62.00,4.38,37 reviews,https://deodap.in/products/18114_waterproof_glue_300gm
Mini Car Interior Cleaning Soft Brush -Car Cleaning...,Rs. 38.00,4.34,47 reviews,https://deodap.in/products/15066_car_dust_removal_brushe_1pc
Mini Rechargeable Keychain Flashlight - 4 Light Modes...,Rs. 79.00,4.71,35 reviews,https://deodap.in/products/rechargeable-keychain-mini-flashlight-with-4-light-modes-ultralight-portable-pocket-light-with-folding-bracket-bottle-opener-and-magnet-base-for-camping-walking-1
4 Meter Festival Decoration LED String Light in...,Rs. 39.00,4.67,48 reviews,https://deodap.in/products/4-meter-festival-decoration-led-string-light-in-multicolor
Bottle Cleaning Brush usual fully types of household...,Rs. 15.75,4.34,38 reviews,https://deodap.in/products/6151a
Velvet Electric Pain Relief Heating Bag,Rs. 93.00,4.68,28 reviews,https://deodap.in/products/velvet-electric-pain-relief-heating-bag
Silicone Body Back Scrubber Double Side Bathing Brush...,Rs. 28.50,4.50,2 reviews,https://deodap.in/products/7275-silicone-body-back-scrubber-double-side-bathing-brush-for-skin-deep-cleaning-scrubber-belt
Sharp Steel Battery-Operated Ear and Nose Hair Trimmer,Rs. 69.00,4.58,33 reviews,https://deodap.in/products/6003-ear-and-nose-hair-trimmer
Face Changing Doll Toy with Keyring (1 Pc...,Rs. 51.00,4.56,50 reviews,https://deodap.in/products/face-changing-doll-toy-with-keyring
Capsule Shape Multipurpose Travel Storage Bottle,Rs. 20.00,4.54,26 reviews,https://deodap.in/products/1361-multipurpose-capsule-shape-portable-travel-storage-bottle-set-of-3-piece
3D VR Box Glasses Virtual Reality Goggles Headset...,Rs. 119.00,4.63,27 reviews,https://deodap.in/products/12838_3d_vr_box_1pc
Electric Handheld Milk Wand Mixer Frother For Latte...,Rs. 49.00,4.43,21 reviews,https://deodap.in/products/0849-electric-handheld-milk-wand-mixer-frother-for-latte-coffee-hot-milk
"Premium Microfiber Cleaning Cloth, Towel (40x30 cm /...",Rs. 27.00,4.97,30 reviews,https://deodap.in/products/premium-microfiber-cleaning-cloth-towel-40x30-cm-1-pc
Plastic 2 in 1 Oil Dispenser Bottle with...,Rs. 48.00,4.08,24 reviews,https://deodap.in/products/10107_2in1_oil_dispenser_bottle_n_brush
Anti-Slip Oval Bathroom Mat for Floor | Waterproof...,Rs. 78.00,3.86,7 reviews,https://deodap.in/products/anti-slip-oval-bathroom-mat-for-floor-waterproof-quick-dry-soft-rubber-mat-printed-bathroom-design-modern-anti-skid-floor-mat-for-bathroom-bathtub-toilet-blue
Quick Turban Hair-Drying Absorbent Microfiber Towel / Dry...,Rs. 52.00,4.07,30 reviews,https://deodap.in/products/1408-quick-turban-hair-drying-absorbent-microfiber-towel-dry-shower-caps
Garden Tool Kit Durable Hand Tools Set with...,Rs. 46.00,4.80,20 reviews,https://deodap.in/products/garden-tool-kit-durable-hand-tools-set-with-wooden-handle-3-pc
Deer Head Self Adhesive Wall Door Hook Hanger,Rs. 31.00,4.70,43 reviews,https://deodap.in/products/1743-deer-head-self-adhesive-wall-door-hook-hanger
Adjustable Trouser Pants Hanger Organizer,Rs. 75.00,4.26,27 reviews,https://deodap.in/products/4660-adjustable-trouser-pants-hanger-organizer
Fun and Educational Coloring Roll (1 Pc),Rs. 85.00,4.53,47 reviews,https://deodap.in/products/fun-and-educational-coloring-roll-1-pc
Comfortable Inflating Travel Pillow (34×21 Cm / 1...,Rs. 45.00,4.75,20 reviews,https://deodap.in/products/comfortable-inflating-travel-pillow-34-21-cm-1-pc-mix-color
Digital LCD 8.5'' inch Writing Drawing Tablet Pad...,Rs. 64.00,4.60,25 reviews,https://deodap.in/products/writing-tablet-kids-lcd-drawing-pad
Anti Crack Silicone Half Gel Heel And Foot...,Rs. 25.00,4.38,24 reviews,https://deodap.in/products/1475-anti-crack-silicone-half-gel-heel-and-foot-protector-moisturizing-socks
Soap Holder Stand Self Draining Soap Dish Holder...,Rs. 20.00,4.49,49 reviews,https://deodap.in/products/self-draining-soap-dish-holder-1pc
Travel Storage Bag – Multipurpose Organizer for Clothes...,Rs. 89.00,4.62,32 reviews,https://deodap.in/products/6111-travelling-storage-bag-used-in-storing-all-types-cloths-and-stuffs-for-travelling-purposes-in-all-kind-of-needs
36 Grids Clear Plastic Organizer Jewelry Storage Box...,Rs. 80.00,4.10,29 reviews,https://deodap.in/products/7673a_plastic_organizer_box
Key Finder Anti Key Lost Key Chain Whistle...,Rs. 47.00,3.88,34 reviews,https://deodap.in/products/18876_keychain-mounted_led_keyfinder
Premium Oval Anti-Slip Bathroom Floor Mat – Super...,Rs. 78.00,4.40,10 reviews,https://deodap.in/products/premium-oval-anti-slip-bathroom-floor-mat-super-absorbent-quick-dry-soft-bath-rug-for-home-hotel-spa-modern-minimal-design-with-non-slip-rubber-base-water-absorbent-surface-washable-bathroom-mat-in-multicolor-shades
USB Mini Air Humidifier for Home & Office...,Rs. 65.00,4.46,41 reviews,https://deodap.in/products/usb-mini-air-humidifier-for-home-office-1-pc
Portable Clothes Lint Remover – Razor Fuzz &...,Rs. 36.00,3.95,22 reviews,https://deodap.in/products/cloth-lint-remover-portable-fuzz-fluff-remover
5-in-1 Charging Kit: Universal Cable for Every Device!,Rs. 65.00,4.70,23 reviews,https://deodap.in/products/5-in-1-charging-kit-universal-cable-for-every-device
Scalp Massager Shampoo Brush (1 Pc),Rs. 27.00,4.90,20 reviews,https://deodap.in/products/scalp-massager-shampoo-brush-1-pc
QuickBurn Steel Kapoor Dani Stand,Rs. 64.00,4.37,30 reviews,https://deodap.in/products/0193-quickburn-steel-kapoor-dani-stand
Mobile Stand for Table Height Adjustable Phone Stand...,Rs. 62.00,4.61,46 reviews,https://deodap.in/products/adjustable-mobile-stand-table-desktop-phone-holder
Super Racer Power Car Set (Set of 25Pcs),Rs. 91.00,4.51,39 reviews,https://deodap.in/products/super-racer-car-set-25-piece-fun-pack
Mini Plastic Bag Sealer – Portable Heat Sealing...,Rs. 61.00,4.55,66 reviews,https://deodap.in/products/7675_mini_sealing_machine
Silicone Food Cover Stretch Lids (6 Pcs Set...,Rs. 58.00,4.16,32 reviews,https://deodap.in/products/12011_sili_food_cover_stretch_lids_6pc
Hair Drying Magic Hair Cap Towel Wrap for...,Rs. 42.00,4.56,34 reviews,https://deodap.in/products/12197_hair_cap_towel_wrap_for_women_1ps
Trigger Sprayer Bottle Replacement Nozzle Plastic Spray B...,Rs. 19.00,4.19,27 reviews,https://deodap.in/products/4607-trigger-sprayer-bottle-replacement-nozzle-plastic-spray-bottle-head-with-pipe
Mini Dustpan with Brush Broom Set for Multipurpose...,Rs. 25.00,4.26,27 reviews,https://deodap.in/products/2213-mini-dustpan-with-brush-broom-set-for-multipurpose-cleaning-2-pcs
3 Digit luggage Lock and tools used widely...,Rs. 21.00,4.39,28 reviews,https://deodap.in/products/6109-3-digit-luggage-lock-and-tool-used-widely-in-all-security-purposes-of-luggage-items-and-materials-1
8-Hole battery operated Bubbles Gun Toys for Boys...,Rs. 66.00,4.41,51 reviews,https://deodap.in/products/bubble-makers-gun-toy-for-boys-and-girls
"6 BLADE 2IN1 MANUAL FOOD CHOPPER, COMPACT &...",Rs. 90.00,4.70,27 reviews,https://deodap.in/products/2065_6blade_1000ml_chopper
Makeup Cutlery Box Girl.,Rs. 61.00,4.61,41 reviews,https://deodap.in/products/0360-makeup-cutlery-box-girl
water spray nozzle for water pipe booster nozzle...,Rs. 65.00,4.45,49 reviews,https://deodap.in/products/7588_golden_water_spray_gun
Shoe Cleaning Wet Wipes (80 Pack) - Travel...,Rs. 57.00,4.74,23 reviews,https://deodap.in/products/wet-wipes-shoe-cleaning
1 Pc Wallmount Mobile Stand With Hook Design...,Rs. 18.00,4.13,47 reviews,https://deodap.in/products/wallmount-mobile-stand-hook-design-phone-holder
Premium Grey Oval Bathroom Floor Mat – Anti-Slip...,Rs. 78.00,4.60,10 reviews,https://deodap.in/products/premium-grey-oval-bathroom-floor-mat-anti-slip-soft-microfiber-bath-rug-for-home-hotel-spa-quick-dry-water-absorbent-washable-bathroom-mat-with-non-skid-rubber-backing-modern-minimalist-design
Non Wooven Fabric Disposable Handy Wipe Cleaning Cloth...,Rs. 61.00,4.18,34 reviews,https://deodap.in/products/1601-non-wooven-fabric-disposable-handy-wipe-cleaning-cloth-roll-1pc-1
"Water Faucet, Clean Purifier Filter Cartridge Water Tap,...",Rs. 39.00,4.31,29 reviews,https://deodap.in/products/9092_6layer_fine_fliter_faucet
"Garden Shears Pruners Scissor for Cutting Branches, Flowe...",Rs. 62.00,4.13,30 reviews,https://deodap.in/products/0465a-garden-shears-pruners-scissor-for-cutting-branches-flowers-leaves-pruning-seeds
Premium 6 Piece LED Flameless Candle Light Set...,Rs. 84.00,0.00,No reviews,https://deodap.in/products/premium-6-piece-led-flameless-candle-light-set-with-remote-control
Spatula and Pastry Brush for Cake Decoration,Rs. 13.00,4.64,14 reviews,https://deodap.in/products/2170-spatula-and-pastry-brush-for-cake-mixer
Eye Mask with Ice Pack Sleeping Mask for...,Rs. 72.00,4.83,24 reviews,https://deodap.in/products/1318-eye-mask-with-ice-pack-sleeping-mask-for-travelling
Metal Universal Mobile & Tablet Stand Holder -...,Rs. 47.00,4.60,10 reviews,https://deodap.in/products/universal-mobile-tablet-stand-holder-1-pc
"Microfiber Car Wash Glove Mitt For Car,Bike,Home &...",Rs. 38.00,4.70,20 reviews,https://deodap.in/products/microfiber-car-wash-glove-mitt-for-car-bike-home-surface
"kinoki Cleansing Detox Foot Pads, Ginger & salt...",Rs. 32.00,3.96,26 reviews,https://deodap.in/products/644-kinoki-cleansing-detox-foot-pads-ginger-salt-foot-patch-10pcs-free-size-white
Metallic Travel Makeup Pouch - (1 Pc),Rs. 76.00,4.70,10 reviews,https://deodap.in/products/metallic-travel-makeup-pouch-1-pc
Electric Vibrating Massager Comb Hair Brush Comb massager...,Rs. 59.00,4.60,55 reviews,https://deodap.in/products/6174-electric-vibrating-massager-comb-hair-brush-comb-massager
Lunch Box Bag for Women Men Insulated Lunch...,Rs. 57.00,4.50,36 reviews,https://deodap.in/products/lunch-box-bag-for-women-men-insulated-lunch-bag-with-zipper-1-pc-1
Premium 2-in-1 Window & Car Windshield Wiper -...,Rs. 59.00,4.70,10 reviews,https://deodap.in/products/premium-2-in-1-window-car-windshield-wiper-1-pc
Electric Hot Water Bag (Loose Packing) (Without Water/Gel),Rs. 75.00,4.52,21 reviews,https://deodap.in/products/electric-hot-water-bag-loose-packing-without-water-gel
USB LED Light Lamp,Rs. 17.00,4.37,30 reviews,https://deodap.in/products/0315-usb-led-light-lamp
Beauty Face Massage Ice Roller (1 Pc),Rs. 15.00,5.00,33 reviews,https://deodap.in/products/13630-face-massage-ice-roller-1pc
Multifunctional Household Mini Portable Super Sealer Hand...,Rs. 52.00,4.30,23 reviews,https://deodap.in/products/7675a-multifunctional-household-mini-portable-super-sealer-handy-plastic-bag-sealer-sealing-machine
"Simple Candles for Home Decoration, Crystal Candle Lights...",Rs. 22.00,4.57,7 reviews,https://deodap.in/products/simple-candles-for-home-decoration-crystal-candle-lights
Clothes Stain Remover Bead Design Emergency Stain Rescue...,Rs. 43.00,4.22,23 reviews,https://deodap.in/products/7933_cloth_stain_remover_50ml-1
"3 Meter Anti-Slip Clothesline Rope - Nylon, Hooks,...",Rs. 24.00,3.97,36 reviews,https://deodap.in/products/fiber-rope-clothesline-with-hooks
Flexible Spiral Cable Protector Sleeve (1 Pc),Rs. 17.00,4.78,50 reviews,https://deodap.in/products/flexible-spiral-cable-protector-sleeve-1-pc
Reusable Waterproof Household Cleaning Gloves (45gm / 1...,Rs. 29.00,4.73,15 reviews,https://deodap.in/products/reusable-waterproof-household-cleaning-gloves-45gm-1-pair
Car Dashboard Scratch Remover Tissue (80 Pcs Set),Rs. 52.00,4.31,35 reviews,https://deodap.in/products/15349_car_cleaning_wipes_80pc
4 LED Battery-Powered Wireless Night Light Stick Tap...,Rs. 34.00,4.50,12 reviews,https://deodap.in/products/1716-4-led-battery-powered-wireless-night-light-stick-tap-touch-lamp-stick-on-push-light-for-closets-cabinets-counters-or-utility-rooms-cordless-touch-light
Projective Camera Keychain (1 Pc / Mix design),Rs. 39.00,4.60,10 reviews,https://deodap.in/products/projective-camera-keychain-1-pc-mix-design
Adhesive Golden &  Transparent Heavy Duty Wall Hook,Rs. 30.00,4.28,25 reviews,https://deodap.in/products/4654-adhesive-4654-adhesive-transparent-heavy-duty-wall-hook
Paint Scraper Window Glass Filling Putty Knife (152...,Rs. 41.00,4.85,39 reviews,https://deodap.in/products/paint-scraper-putty-knife-windows-150mm
Mini Acrylic LED Desk Lamps Table Lamp Portable...,Rs. 46.00,4.50,32 reviews,https://deodap.in/products/6958_mini_led_desk_lamp_1pc
Universal Mini Tripod,Rs. 52.00,4.18,28 reviews,https://deodap.in/products/272-universal-mini-tripod
